{
  "copy_mode": "copy_pack_root",
  "include_benchmark_declarations": true,
  "materialization_reason": "Create a fresh proving-ground build-pack for PackFactory multi-hop autonomy rehearsal.",
  "materialized_by": "codex",
  "schema_version": "build-pack-materialization-request/v1",
  "source_template_id": "release-evidence-summarizer-template-pack",
  "target_build_pack_id": "release-evidence-autonomy-transfer-build-pack-v1",
  "target_display_name": "Release Evidence Autonomy Transfer Build Pack",
  "target_revision": "multi-hop-autonomy-v1",
  "target_version": "0.1.0"
}
